{
  "schema_version": "1.0.0",
  "id": "task-m2-native-collaboration",
  "revision": 1,
  "title": "Package the bounded native collaboration workflow",
  "scope": "Add one distributed reference for owner, audit, handoff, and recovery semantics, then include it in the fixed Plugin bundle.",
  "acceptance": [
    "The workflow limits concurrent delegated agents to three and assigns one write owner per path.",
    "Independent audit is read-only and cannot self-approve implementation work.",
    "A fresh agent can resume from task, handoff, and evidence files without hidden conversation state.",
    "The Plugin fixed allowlist packages and validates the reference without adding a daemon or model identifier."
  ],
  "owner": {
    "id": "implementation-owner",
    "kind": "agent",
    "logical_profile": "implementation",
    "display_name": "Bounded Workflow Implementer"
  },
  "allowed_paths": [
    "plugin/codex-game-atelier/skills/develop-godot-game/SKILL.md",
    "plugin/codex-game-atelier/skills/develop-godot-game/references/native-collaboration.md",
    "tools/package_plugin.py",
    "tools/validators/test_package_plugin.py"
  ],
  "status": "active",
  "dependencies": [],
  "evidence": [],
  "handoff_ref": ".gameatelier/handoffs/handoff-m2-to-implementation.json",
  "updated_at": "2026-08-28T13:28:15Z"
}
